id_video,c1_description,c2_description,c3_description,c4_description,c5_description,c6_description,c7_description,c8_description
p_069,"One hand, palm open with all fingers extended facing forward, extended outwards rightwards then raised upwards to above head and then lowered downwards, dynamic gesture performed once.","One hand, hand open palm facing front, held raised, stationary + One hand, hand open palm facing down, moving touching head rightwards inwards, once.","One hand, open hand extended with palm facing forward rotating to up, swiping rightwards outwards, a dynamic gesture performed once.","One hand, open hand with palm facing forward, swiping leftwards across the body, a dynamic gesture performed once.","One hand, palm open facing forward, raised upwards then lowered downwards, a dynamic gesture performed once.","One hand, index finger, extended, up, pointing, upwards, stationary","One hand, index finger extended with other fingers closed in fist shape palm facing forward, raised pointing upwards then lowered, a dynamic gesture performed once.","One hand, hand open flat edge facing forward, swiping touching neck leftwards, a dynamic gesture performed once + Two hands, hands open palms facing forward, holding spread apart to sides, a static gesture with stationary hand position with small variances in hand pose or position."
p_070,"One hand, hand fist closed opening to all fingers open extended palm facing forward, raising moving upwards, dynamic once + One hand, index finger thumb and pinky fingers extended middle and ring fingers closed facing forward, holding stationary, static stationary.","One hand, thumb and index fingers extended with thumb up and index forward other fingers curled facing forward, pointing raised from below forwards, a dynamic gesture performed once + One hand, index and middle fingers extended and spread in V shape other fingers curled palm facing forward, raised holding upwards, a static gesture with stationary hand position with small variances in hand pose or position.","Two hands, open hands with fingers extended crossed at wrists touching each other facing forward, raising upwards and crossing inwards in front of face holding in X position, dynamic gesture performed once.","Two hands, palms flat extended facing inwards, pressing together raising upwards to face level, dynamic gesture performed once + Two hands, palms open with index finger extended facing forward, touching nose with index finger then spreading apart outwards, dynamic gesture performed once.","One hand, palm open extended facing forward, raised moving upwards to holding forwards, a dynamic gesture performed once + Two hands, open extended facing forward, crossing at wrists together in front, a dynamic gesture performed once.","Two hands, open palms facing forward, raised upwards and crossed inwards touching at wrists in front of face, dynamic gesture performed once + One hand, open palm facing forward, raised upwards, dynamic gesture performed once.","One hand, index finger, closed hand with index extended pointing, palm facing forward finger facing up, pointing moving upwards then downwards, dynamic gesture performed once.","One hand, index and thumb fingers extended point pose facing inwards, raising and pointing moving upwards and forwards, dynamic gesture performed once + One hand, all fingers closed fist shape facing down, swiping moving rightwards, dynamic gesture performed once."
p_071,"One hand; index and middle fingers, extended spread in V shape, palm facing forward; holding spread, apart upwards; static stationary + One hand; index finger, extended point, palm facing down; pointing, forwards; static stationary.","One hand, index and thumb fingers extended point facing forward, raised pointing, forwards, dynamic once + One hand, index finger extended point facing up, rotating, upwards, dynamic once","One hand, index finger extended pointing with palm facing inwards, rotating in a circular motion around the ear rightwards, dynamic gesture performed once.","One hand, index finger extended with other fingers curled palm facing in, holding pressed to mouth stationary, a static gesture with stationary hand position with small variances in hand pose or position.","One hand, palm with all fingers open extended, facing forward; raised holding, forwards; a static gesture with stationary hand position with small variances in hand pose or position.","One hand, all fingers extended open palm facing forward, holding raised forwards, static gesture with stationary hand position + One hand, all fingers extended open palm facing forward, swiping leftwards, dynamic gesture performed once.",One hand; all fingers and palm open extended facing forward; waving leftwards and rightwards; dynamic gesture performed repeatedly.,"One hand, hand open with palm facing forward, waving leftwards and rightwards, dynamic gesture performed repeatedly."
p_072,"One hand, index finger extended facing forward, pointing towards camera, static gesture with stationary hand position with small variances in hand pose or position + One hand, index and thumb fingers pinched to form circle with other fingers extended facing forward, holding towards camera, static gesture with stationary hand position with small variances in hand pose or position.","One hand, index finger extended closed fist pose facing side, raised moving upwards, dynamic gesture performed once + One hand, middle finger extended closed fist pose facing front, pointing moving forwards, dynamic gesture performed once.","One hand, thumb finger extended other fingers closed palm facing inward, raised upwards to chest level, a dynamic gesture performed once + One hand, back hand fingers extended open facing forward, holding pressed against mouth stationary, a static gesture with stationary hand position with small variances in hand pose or position.","Two hands, all fingers extended open palms facing inwards, raised upwards to touch mouth, a dynamic gesture performed once + Two hands, all fingers extended open palms facing forward, held spread apart outwards, a static gesture with stationary hand position with small variances in hand pose or position.","Two hands, palms touching fingers extended pointing up, raised from chest to face upwards, dynamic once + Two hands, thumbs and index fingers pinched forming circles other fingers extended facing forward, holding positioned in front of eyes touching face, static stationary.","Two hands, all fingers from closed to open palms facing forward, opening and raising upwards, dynamic performed once + Two hands, thumbs and index fingers extended fingers curved facing forward, spreading apart outwards and upwards, dynamic performed once.","One hand, index finger extended point facing up other fingers closed palm facing front, holding raised upwards, static gesture with stationary hand position with small variances in hand pose or position.","One hand, index finger extended other fingers curled palm facing down facing forward, pointing forward with small position variances, a static gesture with stationary hand position with small variances in hand pose or position stationary + One hand, index finger extended other fingers curled palm facing inward facing rightwards, swiping across neck touching neck, rightwards, a dynamic gesture performed once."
p_073,"One hand, index finger and thumb extended open facing forward, moving to pinch together then closing into fist downwards, a dynamic gesture performed once.","One hand, index finger extended with other fingers curled in pointing pose facing forward, raising upwards then lowering downwards, a dynamic gesture performed once.","One hand, thumb and index fingers pinched with other fingers extended facing front then rotating inward, raised upwards then lowered downwards while opening fingers, a dynamic gesture performed once.","One hand, all fingers from closed to extended open facing from front to up, opening and turning outwards and upwards, dynamic gesture performed once.","One hand, index finger extended with other fingers curled palm facing forward finger facing up, raised upwards, dynamic performed once + One hand, all fingers closed into fist facing inwards, closing and moving downwards, dynamic performed once.","One hand, closed fist palm facing inward, raised upwards, a dynamic gesture performed once + One hand, index finger extended other fingers closed pointing up, extending upwards, a dynamic gesture performed once.","One hand, hand closed fist palm facing in to open palm facing front, raising and opening to chest level upwards, dynamic gesture performed once + One hand, index finger extended with other fingers closed point facing up to open palm facing in, holding then pressing to touch chest inwards, dynamic gesture performed once.","Two hands, closed fists facing each other, raised to chest and touching together inwards, dynamic gesture performed once + Two hands, open palms facing each other, clapping together inwards, dynamic gesture performed once."
p_074,"One hand, palm and all fingers open extended facing forward, waving leftwards and rightwards, dynamic gesture performed repeatedly.","One hand, palm and all fingers open extended facing forward, raised holding upwards, a static gesture with stationary hand position with small variances in hand pose or position repeatedly","One hand; hand closed in fist, back facing forward; raising to face, upwards; dynamic gesture performed once + One hand; open palm facing in; holding covering mouth, stationary; static gesture with stationary hand position.","One hand, index finger extended with others closed pointing up facing front; raising and pressing against mouth upwards; a dynamic gesture performed once + One hand, palm with all fingers extended open facing forward; raising and holding spread apart; a static gesture with stationary hand position.","One hand, palm open facing forward, raised moving upwards, a dynamic gesture performed once + One hand, index finger extended facing up, holding pressing to mouth, a static gesture with stationary hand position with small variances in hand pose or position.","One hand, index finger extended pointing facing up, raised pointing upwards, dynamic once + One hand, palm and all fingers open extended facing forward, raised holding forwards in front of face, static stationary.",One hand; palm and all fingers open extended facing forward; waving leftwards and rightwards; a dynamic gesture performed repeatedly.,One hand; palm open facing forward; waving leftwards and rightwards; dynamic gesture performed repeatedly.
p_075,"One hand, index finger extended facing in, raised touching ear inwards then holding, stationary.","One hand, index finger extended facing in, pointing to head inwards, dynamic once + One hand, all fingers open facing out, spreading forwards, dynamic once.","One hand, index finger extended facing inwards, raised upwards touching mouth, dynamic performed once.","One hand, all fingers and thumb changing from pinch to open to pinch, facing forward, raising and extending then bringing to mouth touching mouth, upwards then outwards then inwards, dynamic gesture performed once.","One hand, palm open with fingers extended facing forward, holding raised stationary, static gesture with stationary hand position with small variances in hand pose or position + One hand, index finger extended with other fingers curled palm facing down, pointing forwards, static gesture with stationary hand position with small variances in hand pose or position.","Two hands, palms open extended facing forward, raised moving upwards, a dynamic gesture performed once + Two hands, index fingers extended pointing inwards touching cheeks, holding pressing on cheeks, a static gesture with stationary hand position with small variances in hand pose or position stationary.","One hand, index finger extended facing up, raised from touching chin to pointing at head height upwards, dynamic gesture performed once.","Two hands, palms open facing forward, raised upwards, dynamic gesture performed once."
p_076,"One hand, index and middle fingers extended in V shape facing up, raised upwards, stationary + One hand, index and thumb fingers extended in point shape facing forward, pointing forwards, dynamic performed once.","One hand, index and pinky fingers extended with other fingers curled by thumb facing forward, raised holding next to head upwards, static stationary + One hand, all fingers extended open flat facing forward, pressing against ear then moving away outwards and downwards, dynamic performed once.","Two hands, index and pinky fingers extended others curled, open pose facing forward, holding raised pointing upwards at head level, static gesture with stationary hand position + Two hands, index finger extended others curled, pose facing inwards, pressing index fingers into ears pointing inwards, static gesture with stationary hand position.","Two hands, all fingers closed into fists facing forward, clenching from clasped position at chest level, dynamic once + Two hands, fingers extended open facing inwards, raising to touch sides of face then spreading apart outwards, dynamic once.","Two hands, palms open facing forward, raising upwards, dynamic performed once + Two hands, hands open facing inwards, pressing against eyes and holding stationary, static with stationary hand position.","Two hands, palms open facing inward, moving inwards together pressing on eyes, a dynamic gesture performed once + Two hands, palms open facing forward, spreading apart outwards and downwards, a dynamic gesture performed once.","One hand, palm and all fingers open extended facing forward, waving leftwards rightwards, a dynamic gesture performed repeatedly.","Two hands, index and pinky fingers extended other fingers closed palms facing forward, raised from chest to above head upwards then moved inwards to touch head with extended fingers, dynamic gesture performed once + Two hands, all fingers closed into fists then extended open palms facing forward, closing then opening while positioned at head level spreading outwards, dynamic gesture performed once"
p_077,"One hand, index finger extended facing forward, raised pointing upwards, static stationary + One hand, thumb finger extended facing forward, raised pointing upwards, static stationary.","One hand; thumb finger extended, other fingers closed, palm facing forward; raised, upwards; dynamic gesture performed once.","One hand, palm open extended facing forward, raised upwards to face level, a dynamic gesture performed once + One hand, index and thumb fingers pinched touching mouth, holding stationary, a static gesture with stationary hand position.","One hand, thumb and index fingers pinched forming circle with other fingers extended, palm facing forward, raised upwards from chest to face level and held, a dynamic gesture performed once.","One hand; palm, open, all fingers extended, facing forward; raising and holding, upwards; dynamic performed once + One hand; index and thumb fingers, pinch forming circle, other fingers extended, facing forward; pinching and lowering, inwards then downwards; dynamic performed once.","One hand, open hand with all fingers extended palm facing forward, raised to touch head upwards, dynamic gesture performed once + One hand, thumb and index finger extended other fingers curled hand posed in L shape facing forward, pointing forwards while moving downwards, dynamic gesture performed once.","One hand, index finger extended other fingers curled pointing shape palm facing inwards, raising moving upwards touching head, dynamic once + One hand, index finger extended other fingers curled pointing shape palm facing inwards touching head, holding raised, static stationary","One hand, open palm with fingers extended facing forward, raised upwards touching head and waving leftwards and rightwards, dynamic performed repeatedly + One hand, index finger extended with other fingers closed facing inward, moving to touching mouth, dynamic performed once."
p_078,"One hand, index finger extended point facing forward, holding pointing upwards, static gesture with stationary hand position with small variances in hand pose or position.","One hand, index finger extended pointing up with other fingers curled palm facing forward, holding raised at head level pointing upwards, a static gesture with stationary hand position with small variances in hand pose or position.","One hand, index finger extended with other fingers curled back of hand facing forward, holding pressed against mouth, stationary.","One hand, index finger extended facing up, raised touching mouth upwards, dynamic gesture performed once + One hand, palm open facing inwards, pressing on mouth holding, static gesture with stationary hand position with small variances in hand pose or position.","One hand, palm open extended facing forward, holding touching head in place, static stationary","One hand, open hand extended facing forward, raised and swiping upwards then rightwards, dynamic gesture performed once.","One hand, open hand with all fingers extended palm facing forward, held raised upwards, a static gesture with stationary hand position with small variances in hand pose or position.","One hand, thumb and selected fingers, extended in varying combinations, facing front; raised to chest level, changing extended fingers while stationary; dynamic gesture performed once + One hand, index finger, extended pointing, facing various directions; extended forward then moving, pointing downwards leftwards rightwards; dynamic gesture performed once."
p_079,"One hand, index finger extended pointing facing up, raised pointing upwards in front of face, dynamic gesture performed once + One hand, palm open curved facing forward, holding positioned at ear, static gesture with stationary hand position with small variances in hand pose or position.","One hand, thumb and pinky fingers extended other fingers curled pose, facing inward, raised upwards to side of head interacting with ear and mouth holding, static gesture with stationary hand position with small variances in hand pose or position + One hand, palm with all fingers extended open pose, facing forward, moving outwards and downwards from face, dynamic gesture performed once.","One hand, index finger extended with other fingers closed in extend pose facing up, raised upwards touching mouth holding, stationary + One hand, index finger extended with other fingers closed in extend pose facing forward, moving downwards pointing forwards, once.","One hand, open palm with extended fingers facing forward, raising upwards then holding and lowering downwards, dynamic once.","One hand, palm open extended facing forward, holding raised stationary forwards, static stationary.","One hand, palm open extended, facing forward; raised opening, upwards; a dynamic gesture performed once.","One hand; index finger extended, other fingers closed, palm facing forward; raised holding, pointing upwards; a static gesture with stationary hand position with small variances in hand pose or position.","One hand, index finger extended pointing facing up, raising and touching head upwards, dynamic performed once + One hand, palm and all fingers open extended facing forward, spreading and swiping apart and leftwards, dynamic performed once."
p_080,"One hand, closed hand with middle finger extended facing forward, holding raised in front of face upwards, stationary.","One hand, index finger extended palm facing forward facing up, raising upwards, dynamic gesture performed once + One hand, index finger extended palm facing left facing inwards, pointing touching nose inwards, dynamic gesture performed once.","One hand, index finger extended closed hand facing forward, raised pointing upwards, dynamic gesture performed once.","One hand, index finger extended other fingers curled facing front, raised upwards to head level pointing upwards, dynamic gesture performed once + One hand, index finger extended other fingers curled facing inwards, moving inwards touching nose, dynamic gesture performed once.","One hand, palm with all fingers extended open facing forward, holding raised, in front of face, static stationary.","One hand, index finger extended with other fingers curled facing front, raised moving upwards to touch nose, dynamic gesture performed once.","One hand, middle finger extended hand closed palm facing inwards, raised moving upwards in front of face, dynamic gesture performed once.","One hand, open hand palm facing forward, raised upwards and moving rightwards across body, dynamic gesture performed once + One hand, open hand palm facing up, turned and held extended outwards, static gesture with stationary hand position with small variances in hand pose or position."
p_081,"One hand; closed hand with index finger extended, back hand facing forward; holding pressed to chin, stationary; static gesture with stationary hand position with small variances in hand pose or position + One hand; closed hand with index finger extended, palm facing down; moving and pressing to ear with twisting, upwards and inwards; dynamic gesture performed once.","One hand, index finger extended facing inwards, raised upwards to touch ear and rotating circularly, dynamic gesture performed repeatedly.","One hand, index and thumb fingers pinched together, facing front, raised touching nose upwards, a dynamic gesture performed once + One hand, palm and all fingers open extended, facing inward, pressing against face/mouth/nose, a static gesture with stationary hand position with small variances in hand pose or position.","Two hands, index and thumb fingers pinched with other fingers extended transitioning to all fingers spread open, palms facing forward; spreading and raising from in front of chin, upwards apart to sides of head; a dynamic gesture performed once.","One hand, palm open facing forward, raised waving upwards and downwards, dynamic performed repeatedly + One hand, palm open facing forward, swiping leftwards across body touching other arm, dynamic performed once.","One hand, open hand with all fingers extended, palm facing down, swiping across neck rightwards, a dynamic gesture performed once + One hand, open hand with all fingers extended, palm facing forward, raised upwards and held, a static gesture with stationary hand position with small variances in hand pose or position.","One hand, palm open facing forward, holding, upwards, static gesture with stationary hand position with small variances in hand pose or position stationary.","One hand, thumb finger extended with other fingers closed initially then palm open with all fingers extended, facing forward, raised upwards to head level, dynamic gesture performed once."
p_082,"One hand, open palm facing forward, waving leftwards and rightwards, dynamic gesture performed repeatedly.","One hand, palm open facing forward, raised upwards and waving leftwards and rightwards, a dynamic gesture performed repeatedly + One hand, index and thumb fingers extended point facing forward, pointing forwards, a dynamic gesture performed once.","One hand, open palm facing forward, waving leftwards and rightwards, dynamic gesture performed repeatedly.","One hand, palm and all fingers open extended facing forward, waving leftwards and rightwards, dynamic gesture performed repeatedly.","One hand, palm open facing forward, swiping leftwards, a dynamic gesture performed once.","One hand, palm open facing forward, raised upwards to extended position forwards, dynamic once + One hand, palm open facing forward, waving side to side leftwards and rightwards, dynamic repeatedly.","One hand, palm open with fingers extended facing forward, raised waving leftwards and rightwards, dynamic gesture performed repeatedly + One hand, index and middle fingers extended in V shape with others closed facing forward, holding raised, static gesture with stationary hand position.","Two hands, palms closed to open facing forward, raising upwards, dynamic gesture performed once + Two hands, palms open to touch other hand facing forward to in, moving inwards to press together, dynamic gesture performed once"
p_083,"One hand, open hand with fingers extended and split between middle and ring fingers with thumb out palm facing forward, raised and held briefly upwards, dynamic gesture performed repeatedly.","One hand, palm open extended facing forward, waving leftwards rightwards, dynamic gesture performed repeatedly.","One hand, index finger extended with other fingers closed facing forward, raised pointing upwards, a dynamic gesture performed once + Two hands, open hands with fingers extended crossed at wrists facing forward, positioning crossed holding at chest level, a static gesture with stationary hand position with small variances.","One hand, open palm with extended fingers facing forward, waving rightwards, dynamic gesture performed once","One hand, open palm facing forward, raised upwards to face level, a dynamic gesture performed once + One hand, index finger extended with other fingers closed and palm facing down, moving inwards to touch mouth, a dynamic gesture performed once.","Two hands, palms and all fingers open extended facing inward, moving together pressing against each other inwards at chest level, dynamic gesture performed once + Two hands, palms and all fingers pressed together extended facing upward and forward, holding pressed stationary at chest level, static gesture with stationary hand position with small variances.","One hand, palm open facing forward, waving leftwards rightwards, a dynamic gesture performed once.","One hand, palm open facing forward, waving leftwards and rightwards, dynamic repeatedly + One hand, thumb extended facing up with fingers closed, holding raised upwards, static stationary"
